Jobkey,Jobtitle,Company,City,State,Country,FormattedLocation,Date,Snippet,URL,Latitude,Longitude,FormattedRelativeTime
b8bfffd73d5c6424,Data Scientist,iShippo,Bangalore,KA,IN,"Bangalore, Karnataka","Mon, 15 May 2017 15:25:35 GMT","Structured and unstructured data, static and streaming data, extensive prior experience in integrating data, profiling, validating and cleansing data....",http://www.indeed.co.in/viewjob?jk=b8bfffd73d5c6424&qd=hpn1PIYnYFUUyI3l1SSmTmLzJSrmgYmxSc2XHc68el8LOQhlbrWfRyxT2DlRKkuUZxL1zChcII-VCmNVEIlj_wVKxR71e7bk2WYsglV3jkGDBfhE8IgzO_q_LQgY-_NZ&indpubnum=3864921654995829&atk=1bibf0hb61d4j1sq,12.975275,77.5989,26 days ago
73ed642c616daa1e,Manager Pricing Analyst- Data Scientist (1:30 pm IST- 11 pm IST),Cvent,Gurgaon,HR,IN,"Gurgaon, Haryana","Sat, 20 May 2017 06:07:35 GMT",We are looking for a passionate Data scientist for our Senior Pricing Analyst – Data scientist position. Senior Pricing Analyst – Data scientist (India-Based)....,http://www.indeed.co.in/viewjob?jk=73ed642c616daa1e&qd=hpn1PIYnYFUUyI3l1SSmTmLzJSrmgYmxSc2XHc68el8LOQhlbrWfRyxT2DlRKkuUZxL1zChcII-VCmNVEIlj_wVKxR71e7bk2WYsglV3jkGDBfhE8IgzO_q_LQgY-_NZ&indpubnum=3864921654995829&atk=1bibf0hb61d4j1sq,28.464285,77.03297,22 days ago
7e14a552353196a4,Data Scientist - Machine Learning and Bigdata,Fidelity Investments,Bangalore,KA,IN,"Bangalore, Karnataka","Fri, 12 May 2017 09:35:01 GMT",Fidelity Capital Markets team is looking for a Data Scientist to join its Data Science practice. Big Data Models:....,http://www.indeed.co.in/viewjob?jk=7e14a552353196a4&qd=hpn1PIYnYFUUyI3l1SSmTmLzJSrmgYmxSc2XHc68el8LOQhlbrWfRyxT2DlRKkuUZxL1zChcII-VCmNVEIlj_wVKxR71e7bk2WYsglV3jkGDBfhE8IgzO_q_LQgY-_NZ&indpubnum=3864921654995829&atk=1bibf0hb61d4j1sq,12.975275,77.5989,30 days ago
2e7ec7f42c7f1280,Data Scientist,HackerRank,Bangalore,KA,IN,"Bangalore, Karnataka","Thu, 09 Mar 2017 09:27:49 GMT",Be the first experienced data scientist for the company. Not afraid to operate outside a business intelligence platform - happy to pull data straight from...,http://www.indeed.co.in/viewjob?jk=2e7ec7f42c7f1280&qd=hpn1PIYnYFUUyI3l1SSmTmLzJSrmgYmxSc2XHc68el8LOQhlbrWfRyxT2DlRKkuUZxL1zChcII-VCmNVEIlj_wVKxR71e7bk2WYsglV3jkGDBfhE8IgzO_q_LQgY-_NZ&indpubnum=3864921654995829&atk=1bibf0hb61d4j1sq,12.975275,77.5989,30+ days ago
bdcd68eedd6c4fee,Machine Learning Engineer,Phenom People,Hyderabad,TS,IN,"Hyderabad, Telangana","Sat, 15 Apr 2017 09:11:28 GMT","Work closely with Machine Learning Scientists (PhDs), ML engineers, data scientists and data engineers to address challenges head on....",http://www.indeed.co.in/viewjob?jk=bdcd68eedd6c4fee&qd=hpn1PIYnYFUUyI3l1SSmTmLzJSrmgYmxSc2XHc68el8LOQhlbrWfRyxT2DlRKkuUZxL1zChcII-VCmNVEIlj_7BEtRx6ROFuYyj5j1981tiDBfhE8IgzO_q_LQgY-_NZ&indpubnum=3864921654995829&atk=1bibf0l8t1fbd55m,17.373627,78.47253,30+ days ago
c2edd1a74a973f22,USI MD - Eminence - Assistant Manager-Data Scientist-Hyderabad,Deloitte,,TS,IN,"Hyderabad, Telangana","Thu, 08 Jun 2017 15:29:26 GMT","The Data Scientist. Identify data analytics. Eminence CoE- Data Sciences. Data structures using computer programs/algorithms,....",http://www.indeed.co.in/viewjob?jk=c2edd1a74a973f22&qd=hpn1PIYnYFUUyI3l1SSmTmLzJSrmgYmxSc2XHc68el8LOQhlbrWfRyxT2DlRKkuUZxL1zChcII-VCmNVEIlj_7BEtRx6ROFuYyj5j1981tiDBfhE8IgzO_q_LQgY-_NZ&indpubnum=3864921654995829&atk=1bibf0l8t1fbd55m,17.25,78.5,2 days ago
5650b81bd626aed9,Machine Learning Engineer,Lybrate,Delhi,DL,IN,"Delhi, Delhi","Thu, 13 Apr 2017 14:59:06 GMT",People in Data Scientist role at Lybrate are passionate for Internet technology and help further strategic decisions....,http://www.indeed.co.in/viewjob?jk=5650b81bd626aed9&qd=hpn1PIYnYFUUyI3l1SSmTmLzJSrmgYmxSc2XHc68el8LOQhlbrWfRyxT2DlRKkuUZxL1zChcII-VCmNVEIlj_7BEtRx6ROFuYyj5j1981tiDBfhE8IgzO_q_LQgY-_NZ&indpubnum=3864921654995829&atk=1bibf0l8t1fbd55m,28.664835,77.21429,30+ days ago
b0f5688d25aae167,Data Analytics Internship,Qure.ai,Mumbai,MH,IN,"Mumbai, Maharashtra","Sat, 10 Jun 2017 09:47:02 GMT","We are a team of computer scientists, medical practitioners, and bioinformaticians. About the company:....",http://www.indeed.co.in/viewjob?jk=b0f5688d25aae167&qd=hpn1PIYnYFUUyI3l1SSmTmLzJSrmgYmxSc2XHc68el8LOQhlbrWfRyxT2DlRKkuUZxL1zChcII-VCmNVEIlj_7BEtRx6ROFuYyj5j1981tiDBfhE8IgzO_q_LQgY-_NZ&indpubnum=3864921654995829&atk=1bibf0l8t1fbd55m,19.013737,72.84615,1 day ago
76010cd188a34a65,Applied Scientist,ADSIPL - Karnataka,Bangalore,KA,IN,"Bangalore, Karnataka","Tue, 06 Jun 2017 23:43:39 GMT","Strong grasp of machine learning, data mining and data analytics techniques. Mentor other scientists and engineers in the use of ML techniques....",http://www.indeed.co.in/viewjob?jk=76010cd188a34a65&qd=hpn1PIYnYFUUyI3l1SSmTmLzJSrmgYmxSc2XHc68el8LOQhlbrWfRyxT2DlRKkuUZxL1zChcII-VCmNVEIlj_7BEtRx6ROFuYyj5j1981tiDBfhE8IgzO_q_LQgY-_NZ&indpubnum=3864921654995829&atk=1bibf0l8t1fbd55m,12.975275,77.5989,4 days ago
746cf20e9753bf3c,Data Scientist,AIG,Bangalore,KA,IN,"Bangalore, Karnataka","Fri, 09 Jun 2017 12:08:08 GMT"," Demonstrated ability to effectively interpret data and modeling results, distill actionable insights and present them to stakeholders....",http://www.indeed.co.in/viewjob?jk=746cf20e9753bf3c&qd=hpn1PIYnYFUUyI3l1SSmTmLzJSrmgYmxSc2XHc68el8LOQhlbrWfRyxT2DlRKkuUZxL1zChcII-VCmNVEIlj_7BEtRx6ROFuYyj5j1981tiDBfhE8IgzO_q_LQgY-_NZ&indpubnum=3864921654995829&atk=1bibf0l8t1fbd55m,12.975275,77.5989,1 day ago
d8e3fd92cbf28bba,Quant - Data Scientist,State Street,Bangalore,KA,IN,"Bangalore, Karnataka","Thu, 08 Jun 2017 16:27:37 GMT",Our information technology team is looking for a data scientist to support our quantitative investment research efforts....,http://www.indeed.co.in/viewjob?jk=d8e3fd92cbf28bba&qd=hpn1PIYnYFUUyI3l1SSmTmLzJSrmgYmxSc2XHc68el8LOQhlbrWfRyxT2DlRKkuUZxL1zChcII-VCmNVEIlj_7BEtRx6ROFuYyj5j1981tiDBfhE8IgzO_q_LQgY-_NZ&indpubnum=3864921654995829&atk=1bibf0l8t1fbd55m,12.975275,77.5989,2 days ago
6325bf4c4601c3af,Data Scientist,Microsoft,Hyderabad,TS,IN,"Hyderabad, Telangana","Sat, 10 Jun 2017 07:28:55 GMT","The Data Scientist is a linchpin role working within the Services Business Insights team. Experience on Microsoft BI stack and exposure to Big Data, machine...",http://www.indeed.co.in/viewjob?jk=6325bf4c4601c3af&qd=hpn1PIYnYFUUyI3l1SSmTmLzJSrmgYmxSc2XHc68el8LOQhlbrWfRyxT2DlRKkuUZxL1zChcII-VCmNVEIlj_7BEtRx6ROFuYyj5j1981tiDBfhE8IgzO_q_LQgY-_NZ&indpubnum=3864921654995829&atk=1bibf0l8t1fbd55m,17.373627,78.47253,1 day ago
7f6b59f6ec184366,Big Data/Data Scientist/Hadoop,State Street,Bangalore,KA,IN,"Bangalore, Karnataka","Thu, 01 Jun 2017 10:22:23 GMT","About State Street Across the globe, institutional investors rely on us to help them manage risk, respond to challenges, and drive performance and...",http://www.indeed.co.in/viewjob?jk=7f6b59f6ec184366&qd=hpn1PIYnYFUUyI3l1SSmTmLzJSrmgYmxSc2XHc68el8LOQhlbrWfRyxT2DlRKkuUZxL1zChcII-VCmNVEIlj_7BEtRx6ROFuYyj5j1981tiDBfhE8IgzO_q_LQgY-_NZ&indpubnum=3864921654995829&atk=1bibf0l8t1fbd55m,12.975275,77.5989,10 days ago
cc77a41c324c8a24,Data Scientist,MCX India,Gandhinagar,GJ,IN,"Gandhinagar, Gujarat","Fri, 02 Jun 2017 06:03:32 GMT","Responsible for hands-on development with data science using machine learning, trend analytics and toolkit (R Python)....",http://www.indeed.co.in/viewjob?jk=cc77a41c324c8a24&qd=hpn1PIYnYFUUyI3l1SSmTmLzJSrmgYmxSc2XHc68el8LOQhlbrWfRyxT2DlRKkuUZxL1zChcII-VCmNVEIlj_7BEtRx6ROFuYyj5j1981tiDBfhE8IgzO_q_LQgY-_NZ&indpubnum=3864921654995829&atk=1bibf0l8t1fbd55m,23.214285,72.68132,9 days ago
de9556b650411a13,Data Scientist,Société Générale,Bangalore,KA,IN,"Bangalore, Karnataka","Wed, 31 May 2017 14:47:46 GMT","Develop, process, cleanse and enhance data collection procedures from multiple data sources. Prior experience with data visualization tools, such as D3.js,...",http://www.indeed.co.in/viewjob?jk=de9556b650411a13&qd=hpn1PIYnYFUUyI3l1SSmTmLzJSrmgYmxSc2XHc68el8LOQhlbrWfRyxT2DlRKkuUZxL1zChcII-VCmNVEIlj_7BEtRx6ROFuYyj5j1981tiDBfhE8IgzO_q_LQgY-_NZ&indpubnum=3864921654995829&atk=1bibf0l8t1fbd55m,12.975275,77.5989,10 days ago
f1a144deae3a2fa3,ESG IT - Data Scientist - VP,MSCI Inc,Mumbai,MH,IN,"Mumbai, Maharashtra","Fri, 17 Feb 2017 20:43:06 GMT","Closely collaborate with Product Management, Quality Assurance, Data Operation and IT Infrastructure on all stages of software development life cycle....",http://www.indeed.co.in/viewjob?jk=f1a144deae3a2fa3&qd=hpn1PIYnYFUUyI3l1SSmTmLzJSrmgYmxSc2XHc68el8LOQhlbrWfRyxT2DlRKkuUZxL1zChcII-VCmNVEIlj_7BEtRx6ROFuYyj5j1981tiDBfhE8IgzO_q_LQgY-_NZ&indpubnum=3864921654995829&atk=1bibf0l8t1fbd55m,19.013737,72.84615,30+ days ago
e81c68f679ea821a,Data Scientist,ThoughtWorks,Gurgaon,HR,IN,"Gurgaon, Haryana","Mon, 13 Feb 2017 14:22:07 GMT","Has worked in a big data environment before alongside a big data engineering team (and data visualization team, data and business analysts)....",http://www.indeed.co.in/viewjob?jk=e81c68f679ea821a&qd=hpn1PIYnYFUUyI3l1SSmTmLzJSrmgYmxSc2XHc68el8LOQhlbrWfRyxT2DlRKkuUZxL1zChcII-VCmNVEIlj_7BEtRx6ROFuYyj5j1981tiDBfhE8IgzO_q_LQgY-_NZ&indpubnum=3864921654995829&atk=1bibf0l8t1fbd55m,28.464285,77.03297,30+ days ago
ee2820b09e76a0e5,Risk Management Data Scientist,HP,Bangalore,KA,IN,"Bangalore, Karnataka","Thu, 02 Mar 2017 12:34:48 GMT","If you are our Risk Management Data Scientist in Bangalore, India, you will have a chance to Responsibilities Collaborates with partner risk management teams to...",http://www.indeed.co.in/viewjob?jk=ee2820b09e76a0e5&qd=hpn1PIYnYFUUyI3l1SSmTmLzJSrmgYmxSc2XHc68el8LOQhlbrWfRyxT2DlRKkuUZxL1zChcII-VCmNVEIlj_7BEtRx6ROFuYyj5j1981tiDBfhE8IgzO_q_LQgY-_NZ&indpubnum=3864921654995829&atk=1bibf0l8t1fbd55m,12.975275,77.5989,30+ days ago
2d1dcc2bcccf8f63,Analytics Scientist – Big Data,FGBS- Ford Global Business Services,Chennai,TN,IN,"Chennai, Tamil Nadu","Fri, 09 Jun 2017 13:17:17 GMT","Candidates will be working with variety of data sources from flat files, RDBMS, and Hadoop HDFS data sources and must be familiar with Hadoop eco system....",http://www.indeed.co.in/viewjob?jk=2d1dcc2bcccf8f63&qd=hpn1PIYnYFUUyI3l1SSmTmLzJSrmgYmxSc2XHc68el8LOQhlbrWfRyxT2DlRKkuUZxL1zChcII-VCmNVEIlj_7BEtRx6ROFuYyj5j1981tiDBfhE8IgzO_q_LQgY-_NZ&indpubnum=3864921654995829&atk=1bibf0l8t1fbd55m,13.085165,80.27473,1 day ago
f60482db32922299,Data Engineer,General Electric,Bangalore,KA,IN,"Bangalore, Karnataka","Wed, 07 Jun 2017 10:33:35 GMT","Understands logical and physical data models, big data storage architecture, data modeling methodologies, metadata management, master data management, data...",http://www.indeed.co.in/viewjob?jk=f60482db32922299&qd=hpn1PIYnYFUUyI3l1SSmTmLzJSrmgYmxSc2XHc68el8LOQhlbrWfRyxT2DlRKkuUZxL1zChcII-VCmNVEIlj_7BEtRx6ROFuYyj5j1981tiDBfhE8IgzO_q_LQgY-_NZ&indpubnum=3864921654995829&atk=1bibf0l8t1fbd55m,12.975275,77.5989,4 days ago
bc64ad912328cf92,"Data Scientist, Risk Mining",Amazon Dev Center India - Hyderabad,Hyderabad,TS,IN,"Hyderabad, Telangana","Mon, 22 May 2017 05:49:43 GMT","Demonstrate understanding and experience with relational data sets, data warehouses, data mining and data analysis techniques....",http://www.indeed.co.in/viewjob?jk=bc64ad912328cf92&qd=hpn1PIYnYFUUyI3l1SSmTmLzJSrmgYmxSc2XHc68el8LOQhlbrWfRyxT2DlRKkuUZxL1zChcII-VCmNVEIlj_7BEtRx6ROFuYyj5j1981tiDBfhE8IgzO_q_LQgY-_NZ&indpubnum=3864921654995829&atk=1bibf0l8t1fbd55m,17.373627,78.47253,20 days ago
a849bafd7d413b79,Data Scientist,UnitedHealth Group,Noida,UP,IN,"Noida, Uttar Pradesh","Wed, 31 May 2017 00:22:38 GMT","Engage in client communications for all important functions including data understanding/exploration, strategizing solutions etc....",http://www.indeed.co.in/viewjob?jk=a849bafd7d413b79&qd=hpn1PIYnYFUUyI3l1SSmTmLzJSrmgYmxSc2XHc68el8LOQhlbrWfRyxT2DlRKkuUZxL1zChcII-VCmNVEIlj_7BEtRx6ROFuYyj5j1981tiDBfhE8IgzO_q_LQgY-_NZ&indpubnum=3864921654995829&atk=1bibf0l8t1fbd55m,28.57967,77.32967,11 days ago
34f5279de66d71fd,Data & Applied Scientist,Microsoft,Bangalore,KA,IN,"Bangalore, Karnataka","Fri, 19 May 2017 07:10:14 GMT","You will design, implement, analyze and tune complex algorithms and ML models operating on large datasets in collaboration with top scientists and engineers...",http://www.indeed.co.in/viewjob?jk=34f5279de66d71fd&qd=hpn1PIYnYFUUyI3l1SSmTmLzJSrmgYmxSc2XHc68el8LOQhlbrWfRyxT2DlRKkuUZxL1zChcII-VCmNVEIlj_7BEtRx6ROFuYyj5j1981tiDBfhE8IgzO_q_LQgY-_NZ&indpubnum=3864921654995829&atk=1bibf0l8t1fbd55m,12.975275,77.5989,23 days ago
23f79fba1ed6e535,Data Scientist,Metacube,Jaipur,RJ,IN,"Jaipur, Rajasthan","Sat, 03 Jun 2017 09:29:46 GMT","As a data scientist/ engineer, you will be involved in analyzing big data, identify patterns using advanced data mining algorithms and generate insights for...",http://www.indeed.co.in/viewjob?jk=23f79fba1ed6e535&qd=hpn1PIYnYFUUyI3l1SSmTmLzJSrmgYmxSc2XHc68el8LOQhlbrWfRyxT2DlRKkuUZxL1zChcII-VCmNVEIlj_7BEtRx6ROFuYyj5j1981tiDBfhE8IgzO_q_LQgY-_NZ&indpubnum=3864921654995829&atk=1bibf0l8t1fbd55m,26.914835,75.81319,8 days ago
b8bfffd73d5c6424,Data Scientist,iShippo,Bangalore,KA,IN,"Bangalore, Karnataka","Mon, 15 May 2017 15:25:35 GMT","Structured and unstructured data, static and streaming data, extensive prior experience in integrating data, profiling, validating and cleansing data....",http://www.indeed.co.in/viewjob?jk=b8bfffd73d5c6424&qd=hpn1PIYnYFUUyI3l1SSmTmLzJSrmgYmxSc2XHc68el8LOQhlbrWfRyxT2DlRKkuUZxL1zChcII-VCmNVEIlj_7BEtRx6ROFuYyj5j1981tiDBfhE8IgzO_q_LQgY-_NZ&indpubnum=3864921654995829&atk=1bibf0l8t1fbd55m,12.975275,77.5989,26 days ago
73ed642c616daa1e,Manager Pricing Analyst- Data Scientist (1:30 pm IST- 11 pm IST),Cvent,Gurgaon,HR,IN,"Gurgaon, Haryana","Sat, 20 May 2017 06:07:35 GMT",We are looking for a passionate Data scientist for our Senior Pricing Analyst – Data scientist position. Senior Pricing Analyst – Data scientist (India-Based)....,http://www.indeed.co.in/viewjob?jk=73ed642c616daa1e&qd=hpn1PIYnYFUUyI3l1SSmTmLzJSrmgYmxSc2XHc68el8LOQhlbrWfRyxT2DlRKkuUZxL1zChcII-VCmNVEIlj_7BEtRx6ROFuYyj5j1981tiDBfhE8IgzO_q_LQgY-_NZ&indpubnum=3864921654995829&atk=1bibf0l8t1fbd55m,28.464285,77.03297,22 days ago
7e14a552353196a4,Data Scientist - Machine Learning and Bigdata,Fidelity Investments,Bangalore,KA,IN,"Bangalore, Karnataka","Fri, 12 May 2017 09:35:01 GMT",Fidelity Capital Markets team is looking for a Data Scientist to join its Data Science practice. Big Data Models:....,http://www.indeed.co.in/viewjob?jk=7e14a552353196a4&qd=hpn1PIYnYFUUyI3l1SSmTmLzJSrmgYmxSc2XHc68el8LOQhlbrWfRyxT2DlRKkuUZxL1zChcII-VCmNVEIlj_7BEtRx6ROFuYyj5j1981tiDBfhE8IgzO_q_LQgY-_NZ&indpubnum=3864921654995829&atk=1bibf0l8t1fbd55m,12.975275,77.5989,30 days ago
2e7ec7f42c7f1280,Data Scientist,HackerRank,Bangalore,KA,IN,"Bangalore, Karnataka","Thu, 09 Mar 2017 09:27:49 GMT",Be the first experienced data scientist for the company. Not afraid to operate outside a business intelligence platform - happy to pull data straight from...,http://www.indeed.co.in/viewjob?jk=2e7ec7f42c7f1280&qd=hpn1PIYnYFUUyI3l1SSmTmLzJSrmgYmxSc2XHc68el8LOQhlbrWfRyxT2DlRKkuUZxL1zChcII-VCmNVEIlj_7BEtRx6ROFuYyj5j1981tiDBfhE8IgzO_q_LQgY-_NZ&indpubnum=3864921654995829&atk=1bibf0l8t1fbd55m,12.975275,77.5989,30+ days ago
663ccb70320a5017,Senior Data Analyst - Global Financial Institutions Center,McKinsey & Company,Gurgaon,HR,IN,"Gurgaon, Haryana","Fri, 12 May 2017 12:18:13 GMT",Data Scientists are creative problem solvers who love all things data. Understanding of the analytics and corresponding compatible data needs;...,http://www.indeed.co.in/viewjob?jk=663ccb70320a5017&qd=hpn1PIYnYFUUyI3l1SSmTmLzJSrmgYmxSc2XHc68el8LOQhlbrWfRyxT2DlRKkuUZxL1zChcII-VCmNVEIlj_7BEtRx6ROFuYyj5j1981tiDBfhE8IgzO_q_LQgY-_NZ&indpubnum=3864921654995829&atk=1bibf0l8t1fbd55m,28.464285,77.03297,29 days ago
c2edd1a74a973f22,USI MD - Eminence - Assistant Manager-Data Scientist-Hyderabad,Deloitte,,TS,IN,"Hyderabad, Telangana","Thu, 08 Jun 2017 15:29:26 GMT","The Data Scientist. Identify data analytics. Eminence CoE- Data Sciences. Data structures using computer programs/algorithms,....",http://www.indeed.co.in/viewjob?jk=c2edd1a74a973f22&qd=hpn1PIYnYFUUyI3l1SSmTmLzJSrmgYmxSc2XHc68el8LOQhlbrWfRyxT2DlRKkuUZxL1zChcII-VCmNVEIlj_2DO1JFRx3qZK3E2t5bUHRaDBfhE8IgzO_q_LQgY-_NZ&indpubnum=3864921654995829&atk=1bibf0p661e7h1l4,17.25,78.5,2 days ago
5650b81bd626aed9,Machine Learning Engineer,Lybrate,Delhi,DL,IN,"Delhi, Delhi","Thu, 13 Apr 2017 14:59:06 GMT",People in Data Scientist role at Lybrate are passionate for Internet technology and help further strategic decisions....,http://www.indeed.co.in/viewjob?jk=5650b81bd626aed9&qd=hpn1PIYnYFUUyI3l1SSmTmLzJSrmgYmxSc2XHc68el8LOQhlbrWfRyxT2DlRKkuUZxL1zChcII-VCmNVEIlj_2DO1JFRx3qZK3E2t5bUHRaDBfhE8IgzO_q_LQgY-_NZ&indpubnum=3864921654995829&atk=1bibf0p661e7h1l4,28.664835,77.21429,30+ days ago
b0f5688d25aae167,Data Analytics Internship,Qure.ai,Mumbai,MH,IN,"Mumbai, Maharashtra","Sat, 10 Jun 2017 09:47:02 GMT","We are a team of computer scientists, medical practitioners, and bioinformaticians. About the company:....",http://www.indeed.co.in/viewjob?jk=b0f5688d25aae167&qd=hpn1PIYnYFUUyI3l1SSmTmLzJSrmgYmxSc2XHc68el8LOQhlbrWfRyxT2DlRKkuUZxL1zChcII-VCmNVEIlj_2DO1JFRx3qZK3E2t5bUHRaDBfhE8IgzO_q_LQgY-_NZ&indpubnum=3864921654995829&atk=1bibf0p661e7h1l4,19.013737,72.84615,1 day ago
76010cd188a34a65,Applied Scientist,ADSIPL - Karnataka,Bangalore,KA,IN,"Bangalore, Karnataka","Tue, 06 Jun 2017 23:43:39 GMT","Strong grasp of machine learning, data mining and data analytics techniques. Mentor other scientists and engineers in the use of ML techniques....",http://www.indeed.co.in/viewjob?jk=76010cd188a34a65&qd=hpn1PIYnYFUUyI3l1SSmTmLzJSrmgYmxSc2XHc68el8LOQhlbrWfRyxT2DlRKkuUZxL1zChcII-VCmNVEIlj_2DO1JFRx3qZK3E2t5bUHRaDBfhE8IgzO_q_LQgY-_NZ&indpubnum=3864921654995829&atk=1bibf0p661e7h1l4,12.975275,77.5989,4 days ago
746cf20e9753bf3c,Data Scientist,AIG,Bangalore,KA,IN,"Bangalore, Karnataka","Fri, 09 Jun 2017 12:08:08 GMT"," Demonstrated ability to effectively interpret data and modeling results, distill actionable insights and present them to stakeholders....",http://www.indeed.co.in/viewjob?jk=746cf20e9753bf3c&qd=hpn1PIYnYFUUyI3l1SSmTmLzJSrmgYmxSc2XHc68el8LOQhlbrWfRyxT2DlRKkuUZxL1zChcII-VCmNVEIlj_2DO1JFRx3qZK3E2t5bUHRaDBfhE8IgzO_q_LQgY-_NZ&indpubnum=3864921654995829&atk=1bibf0p661e7h1l4,12.975275,77.5989,1 day ago
d8e3fd92cbf28bba,Quant - Data Scientist,State Street,Bangalore,KA,IN,"Bangalore, Karnataka","Thu, 08 Jun 2017 16:27:37 GMT",Our information technology team is looking for a data scientist to support our quantitative investment research efforts....,http://www.indeed.co.in/viewjob?jk=d8e3fd92cbf28bba&qd=hpn1PIYnYFUUyI3l1SSmTmLzJSrmgYmxSc2XHc68el8LOQhlbrWfRyxT2DlRKkuUZxL1zChcII-VCmNVEIlj_2DO1JFRx3qZK3E2t5bUHRaDBfhE8IgzO_q_LQgY-_NZ&indpubnum=3864921654995829&atk=1bibf0p661e7h1l4,12.975275,77.5989,2 days ago
6325bf4c4601c3af,Data Scientist,Microsoft,Hyderabad,TS,IN,"Hyderabad, Telangana","Sat, 10 Jun 2017 07:28:55 GMT","The Data Scientist is a linchpin role working within the Services Business Insights team. Experience on Microsoft BI stack and exposure to Big Data, machine...",http://www.indeed.co.in/viewjob?jk=6325bf4c4601c3af&qd=hpn1PIYnYFUUyI3l1SSmTmLzJSrmgYmxSc2XHc68el8LOQhlbrWfRyxT2DlRKkuUZxL1zChcII-VCmNVEIlj_2DO1JFRx3qZK3E2t5bUHRaDBfhE8IgzO_q_LQgY-_NZ&indpubnum=3864921654995829&atk=1bibf0p661e7h1l4,17.373627,78.47253,1 day ago
7f6b59f6ec184366,Big Data/Data Scientist/Hadoop,State Street,Bangalore,KA,IN,"Bangalore, Karnataka","Thu, 01 Jun 2017 10:22:23 GMT","About State Street Across the globe, institutional investors rely on us to help them manage risk, respond to challenges, and drive performance and...",http://www.indeed.co.in/viewjob?jk=7f6b59f6ec184366&qd=hpn1PIYnYFUUyI3l1SSmTmLzJSrmgYmxSc2XHc68el8LOQhlbrWfRyxT2DlRKkuUZxL1zChcII-VCmNVEIlj_2DO1JFRx3qZK3E2t5bUHRaDBfhE8IgzO_q_LQgY-_NZ&indpubnum=3864921654995829&atk=1bibf0p661e7h1l4,12.975275,77.5989,10 days ago
cc77a41c324c8a24,Data Scientist,MCX India,Gandhinagar,GJ,IN,"Gandhinagar, Gujarat","Fri, 02 Jun 2017 06:03:32 GMT","Responsible for hands-on development with data science using machine learning, trend analytics and toolkit (R Python)....",http://www.indeed.co.in/viewjob?jk=cc77a41c324c8a24&qd=hpn1PIYnYFUUyI3l1SSmTmLzJSrmgYmxSc2XHc68el8LOQhlbrWfRyxT2DlRKkuUZxL1zChcII-VCmNVEIlj_2DO1JFRx3qZK3E2t5bUHRaDBfhE8IgzO_q_LQgY-_NZ&indpubnum=3864921654995829&atk=1bibf0p661e7h1l4,23.214285,72.68132,9 days ago
de9556b650411a13,Data Scientist,Société Générale,Bangalore,KA,IN,"Bangalore, Karnataka","Wed, 31 May 2017 14:47:46 GMT","Develop, process, cleanse and enhance data collection procedures from multiple data sources. Prior experience with data visualization tools, such as D3.js,...",http://www.indeed.co.in/viewjob?jk=de9556b650411a13&qd=hpn1PIYnYFUUyI3l1SSmTmLzJSrmgYmxSc2XHc68el8LOQhlbrWfRyxT2DlRKkuUZxL1zChcII-VCmNVEIlj_2DO1JFRx3qZK3E2t5bUHRaDBfhE8IgzO_q_LQgY-_NZ&indpubnum=3864921654995829&atk=1bibf0p661e7h1l4,12.975275,77.5989,10 days ago
f1a144deae3a2fa3,ESG IT - Data Scientist - VP,MSCI Inc,Mumbai,MH,IN,"Mumbai, Maharashtra","Fri, 17 Feb 2017 20:43:06 GMT","Closely collaborate with Product Management, Quality Assurance, Data Operation and IT Infrastructure on all stages of software development life cycle....",http://www.indeed.co.in/viewjob?jk=f1a144deae3a2fa3&qd=hpn1PIYnYFUUyI3l1SSmTmLzJSrmgYmxSc2XHc68el8LOQhlbrWfRyxT2DlRKkuUZxL1zChcII-VCmNVEIlj_2DO1JFRx3qZK3E2t5bUHRaDBfhE8IgzO_q_LQgY-_NZ&indpubnum=3864921654995829&atk=1bibf0p661e7h1l4,19.013737,72.84615,30+ days ago
e81c68f679ea821a,Data Scientist,ThoughtWorks,Gurgaon,HR,IN,"Gurgaon, Haryana","Mon, 13 Feb 2017 14:22:07 GMT","Has worked in a big data environment before alongside a big data engineering team (and data visualization team, data and business analysts)....",http://www.indeed.co.in/viewjob?jk=e81c68f679ea821a&qd=hpn1PIYnYFUUyI3l1SSmTmLzJSrmgYmxSc2XHc68el8LOQhlbrWfRyxT2DlRKkuUZxL1zChcII-VCmNVEIlj_2DO1JFRx3qZK3E2t5bUHRaDBfhE8IgzO_q_LQgY-_NZ&indpubnum=3864921654995829&atk=1bibf0p661e7h1l4,28.464285,77.03297,30+ days ago
ee2820b09e76a0e5,Risk Management Data Scientist,HP,Bangalore,KA,IN,"Bangalore, Karnataka","Thu, 02 Mar 2017 12:34:48 GMT","If you are our Risk Management Data Scientist in Bangalore, India, you will have a chance to Responsibilities Collaborates with partner risk management teams to...",http://www.indeed.co.in/viewjob?jk=ee2820b09e76a0e5&qd=hpn1PIYnYFUUyI3l1SSmTmLzJSrmgYmxSc2XHc68el8LOQhlbrWfRyxT2DlRKkuUZxL1zChcII-VCmNVEIlj_2DO1JFRx3qZK3E2t5bUHRaDBfhE8IgzO_q_LQgY-_NZ&indpubnum=3864921654995829&atk=1bibf0p661e7h1l4,12.975275,77.5989,30+ days ago
2d1dcc2bcccf8f63,Analytics Scientist – Big Data,FGBS- Ford Global Business Services,Chennai,TN,IN,"Chennai, Tamil Nadu","Fri, 09 Jun 2017 13:17:17 GMT","Candidates will be working with variety of data sources from flat files, RDBMS, and Hadoop HDFS data sources and must be familiar with Hadoop eco system....",http://www.indeed.co.in/viewjob?jk=2d1dcc2bcccf8f63&qd=hpn1PIYnYFUUyI3l1SSmTmLzJSrmgYmxSc2XHc68el8LOQhlbrWfRyxT2DlRKkuUZxL1zChcII-VCmNVEIlj_2DO1JFRx3qZK3E2t5bUHRaDBfhE8IgzO_q_LQgY-_NZ&indpubnum=3864921654995829&atk=1bibf0p661e7h1l4,13.085165,80.27473,1 day ago
f60482db32922299,Data Engineer,General Electric,Bangalore,KA,IN,"Bangalore, Karnataka","Wed, 07 Jun 2017 10:33:35 GMT","Understands logical and physical data models, big data storage architecture, data modeling methodologies, metadata management, master data management, data...",http://www.indeed.co.in/viewjob?jk=f60482db32922299&qd=hpn1PIYnYFUUyI3l1SSmTmLzJSrmgYmxSc2XHc68el8LOQhlbrWfRyxT2DlRKkuUZxL1zChcII-VCmNVEIlj_2DO1JFRx3qZK3E2t5bUHRaDBfhE8IgzO_q_LQgY-_NZ&indpubnum=3864921654995829&atk=1bibf0p661e7h1l4,12.975275,77.5989,4 days ago
bc64ad912328cf92,"Data Scientist, Risk Mining",Amazon Dev Center India - Hyderabad,Hyderabad,TS,IN,"Hyderabad, Telangana","Mon, 22 May 2017 05:49:43 GMT","Demonstrate understanding and experience with relational data sets, data warehouses, data mining and data analysis techniques....",http://www.indeed.co.in/viewjob?jk=bc64ad912328cf92&qd=hpn1PIYnYFUUyI3l1SSmTmLzJSrmgYmxSc2XHc68el8LOQhlbrWfRyxT2DlRKkuUZxL1zChcII-VCmNVEIlj_2DO1JFRx3qZK3E2t5bUHRaDBfhE8IgzO_q_LQgY-_NZ&indpubnum=3864921654995829&atk=1bibf0p661e7h1l4,17.373627,78.47253,20 days ago
a849bafd7d413b79,Data Scientist,UnitedHealth Group,Noida,UP,IN,"Noida, Uttar Pradesh","Wed, 31 May 2017 00:22:38 GMT","Engage in client communications for all important functions including data understanding/exploration, strategizing solutions etc....",http://www.indeed.co.in/viewjob?jk=a849bafd7d413b79&qd=hpn1PIYnYFUUyI3l1SSmTmLzJSrmgYmxSc2XHc68el8LOQhlbrWfRyxT2DlRKkuUZxL1zChcII-VCmNVEIlj_2DO1JFRx3qZK3E2t5bUHRaDBfhE8IgzO_q_LQgY-_NZ&indpubnum=3864921654995829&atk=1bibf0p661e7h1l4,28.57967,77.32967,11 days ago
34f5279de66d71fd,Data & Applied Scientist,Microsoft,Bangalore,KA,IN,"Bangalore, Karnataka","Fri, 19 May 2017 07:10:14 GMT","You will design, implement, analyze and tune complex algorithms and ML models operating on large datasets in collaboration with top scientists and engineers...",http://www.indeed.co.in/viewjob?jk=34f5279de66d71fd&qd=hpn1PIYnYFUUyI3l1SSmTmLzJSrmgYmxSc2XHc68el8LOQhlbrWfRyxT2DlRKkuUZxL1zChcII-VCmNVEIlj_2DO1JFRx3qZK3E2t5bUHRaDBfhE8IgzO_q_LQgY-_NZ&indpubnum=3864921654995829&atk=1bibf0p661e7h1l4,12.975275,77.5989,23 days ago
23f79fba1ed6e535,Data Scientist,Metacube,Jaipur,RJ,IN,"Jaipur, Rajasthan","Sat, 03 Jun 2017 09:29:46 GMT","As a data scientist/ engineer, you will be involved in analyzing big data, identify patterns using advanced data mining algorithms and generate insights for...",http://www.indeed.co.in/viewjob?jk=23f79fba1ed6e535&qd=hpn1PIYnYFUUyI3l1SSmTmLzJSrmgYmxSc2XHc68el8LOQhlbrWfRyxT2DlRKkuUZxL1zChcII-VCmNVEIlj_2DO1JFRx3qZK3E2t5bUHRaDBfhE8IgzO_q_LQgY-_NZ&indpubnum=3864921654995829&atk=1bibf0p661e7h1l4,26.914835,75.81319,8 days ago
